{
  "txn_id": "11111111-1111-1111-1111-111111111111",
  "user_id": "22222222-2222-2222-2222-222222222222",
  "bank_id": "tinkoff",
  "posted_at": "2025-07-01T12:34:56Z",
  "amount": {"value": "1250.50", "currency": "RUB"},
  "mcc": 5411,
  "direction": "out",
  "description": "Перекрёсток",
  "account_external": "40817810123456789012",
  "external_id": "bank_op_id",
  "raw": {"example": true}
}
